{
  "status": "brand_ambiguous",
  "checked": "2026-09-28T14:02:11Z",
  "valid_until": "2026-09-28T14:17:11Z",
  "stale_until": "2026-09-29T14:02:11Z",
  "signature": {
    "kid": "ar-20260928-6e37",
    "jws": "eyJhbGciOiJFZERTQSIsImtpZCI6ImFyLTIwMjYwOTI4LTZlMzcifQ..c2lnbmF0dXJlLXBsYWNlaG9sZGVy"
  },
  "candidates": [
    {
      "domain": "brand.example",
      "name": "Example Brand"
    },
    {
      "domain": "other.example",
      "name": "Other Brand"
    }
  ]
}
